A Boy and His Blob;72;Octobre;2009;Action, Adventure, Arcade, Puzzle, Platformer;5 hours;Abstraction Games, WayForward Technologies, Majesco Entertainment Company, Majesco Entertainment, Majesco Games, Skyworks Technologies;Majesco Entertainment, Midnight City;https://rawg.io/games/a-boy-and-his-blob
Ys: The Oath in Felghana;73;Juin;2005;Action, Adventure, RPG;4 hours;XSEED Games, Falcom;XSEED Games;https://rawg.io/games/ys-the-oath-in-felghana
TRANSFORMERS: Fall of Cybertron;78;Août;2012;Action, Shooter;6 hours;Activision, High Moon Studios, Mercenary Technologies;Activision Blizzard;https://rawg.io/games/transformers-foc
MirrorMoon EP;73;Septembre;2013;Adventure, Indie;2 hours;Santa Ragione;Santa Ragione;https://rawg.io/games/mirrormoon-ep
Carrier Command: Gaea Mission;53;Septembre;2012;Action, Strategy;1 hour;Bohemia Interactive;Bohemia Interactive, Rising Star Games;https://rawg.io/games/carrier-command-gaea-mission
Layers of Fear 2;68;Mai;2019;Adventure, Casual, Indie;4 hours;Bloober Team, GUN MEDIA HOLDINGS;Bloober Team, Gun Media;https://rawg.io/games/layers-of-fear-2
In Between;68;Août;2015;Adventure, Indie;4 hours;Headup Games, Gentlymad, Brandon Rabico;Headup Games, Brandon Rabico;https://rawg.io/games/in-between
AquaNox 2: Revelation;59;Août;2003;Action, Shooter;1 hour;THQ Nordic, Massive Development;THQ Nordic;https://rawg.io/games/aquanox-2-revelation
Dragons and Titans;43;Mars;2014;Action, Adventure, RPG, Indie;1 hour;Wyrmbyte;Versus Evil;https://rawg.io/games/dragons-and-titans
Outcast - Second Contact;65;Novembre;2017;Action, Adventure;3 hours;Appeal;Infogrames, Bigben Interactive;https://rawg.io/games/outcast-second-contact
Syder Arcade;76;Octobre;2013;Action, Indie;3 hours;Studio Evil;Studio Evil;https://rawg.io/games/syder-arcade
World to the West;75;Mai;2017;Action, Adventure, RPG, Indie, Platformer;7 hours;Rain Games;Rain Games;https://rawg.io/games/world-to-the-west
SWORD ART ONLINE: Fatal Bullet;66;Février;2018;Action, Shooter, RPG;7 hours;BANDAI NAMCO Entertainment America, DIMPS;Bandai Namco Entertainment, BANDAI NAMCO Entertainment US;https://rawg.io/games/sword-art-online-fatal-bullet
Syndicate (2012);73;Février;2012;Action, Shooter;5 hours;Electronic Arts, Starbreeze Studios, EAP;Electronic Arts;https://rawg.io/games/syndicate-2012
Space Hulk: Deathwing;58;Décembre;2016;Action, Adventure;4 hours;Streum On Studio;Focus Home Interactive;https://rawg.io/games/space-hulk-deathwing
Forgotton Anne;80;Mai;2018;Action, Adventure, Casual, Indie;4 hours;Square Enix, Hitcents.com, ThroughLine Games;Square Enix, Hitcents.com;https://rawg.io/games/forgotton-anne
The Disney Afternoon Collection;77;Avril;2017;Action;2 hours;Capcom, Capcom U.S.A, Digital Eclipse;Capcom;https://rawg.io/games/the-disney-afternoon-collection
Shadows of the Damned;76;Juin;2011;Action, Shooter;2 hours;Electronic Arts, Grasshopper Manufacture;Electronic Arts;https://rawg.io/games/shadows-of-the-damned
Medieval Dynasty;73;Septembre;2020;Action, Adventure, RPG, Simulation;7 hours;Render Cube, Toplitz Productions;Toplitz Productions;https://rawg.io/games/medieval-dynasty
Krater;52;Juin;2012;Action, Adventure, RPG, Strategy, Indie;3 hours;Fatshark;Fatshark;https://rawg.io/games/krater
LEGO The Incredibles;69;Juin;2018;Action, Adventure;3 hours;TT Fusion;Warner Bros. Interactive;https://rawg.io/games/lego-the-incredibles
Army of Two: The 40th Day;74;Janvier;2010;Action, Shooter, Adventure;19 hours;Electronic Arts, Electronic Arts Montreal, Buzz Monkey;Electronic Arts;https://rawg.io/games/army-of-two-tfd
CRYPTARK;80;Octobre;2015;Action, Shooter, Adventure, Strategy, Indie;1 hour;Alientrap;Alientrap, Alientrap Games;https://rawg.io/games/cryptark
Total War: WARHAMMER III;85;Février;2022;Action, Strategy;17 hours;Creative Assembly;SEGA, Feral Interactive;https://rawg.io/games/total-war-warhammer-iii
We Are The Dwarves;60;Février;2016;Action, Adventure, RPG, Indie;3 hours;Whale Rock Games;Whale Rock Games;https://rawg.io/games/we-are-the-dwarves
Between Me and The Night;62;Janvier;2016;Action, Adventure, Indie;5 hours;RainDance LX;Kiss, Lace Games;https://rawg.io/games/between-me-and-the-night
Flat Heroes;82;Septembre;2016;Action, Indie, Platformer;1 hour;Parallel Circles, FlatHeroes;Deck13, Deck 13, Parallel Circles;https://rawg.io/games/flat-heroes
Guns, Gore & Cannoli;74;Avril;2015;Action, Shooter, Arcade, Indie;4 hours;Claeysbrothers, Crazy Monkey Studios, Claeys Brothers;Crazy Monkey Studios, Crazy Monkey;https://rawg.io/games/guns-gore-cannoli
Silent Hill 4: The Room;72;Juin;2004;Action;1 hour;Team Silent;Konami;https://rawg.io/games/silent-hill-4-the-room
TRON: Evolution - The Video Game;57;Novembre;2010;Action, Shooter, Adventure, Racing, Arcade;5 hours;n-Space, Disney Interactive Studios, SuperVillain Studios, Propaganda Games;Disney Interactive;https://rawg.io/games/tron-evolution
Road to Ballhalla;75;Août;2016;Action, Adventure, Racing, Indie;1 hour;tinyBuild, Torched Hill;tinyBuild;https://rawg.io/games/road-to-ballhalla
The Journey Down: Chapter Two;78;Août;2014;Adventure, Indie, Puzzle;4 hours;BlitWorks, SkyGoblin;BlitWorks, SkyGoblin ek. for.;https://rawg.io/games/the-journey-down-chapter-two
DARK;41;Juin;2013;Action, Adventure, RPG, Casual, Indie;3 hours;Realmforge Studios, James Nye, Cope Williams, PotatoFaceGames, Gabrielle Games;Kalypso Media, PotatoFaceGames, Gabrielle Games;https://rawg.io/games/dark
Gothic 2;79;Novembre;2002;Action, RPG;46 hours;Piranha Bytes;JoWooD Productions;https://rawg.io/games/gothic-2
"Hyperdimension Neptunia Re ; Birth2 Sisters Generation";67;Janvier;2015;Adventure, RPG, Fighting;6 hours;Idea Factory, Compile Heart, Felistella;Retroism, Idea Factory, Nippon Ichi Software;https://rawg.io/games/hyperdimension-neptunia-rebirth2
Hospital Tycoon;51;Juin;2007;Simulation;1 hour;Deep Red;Codemasters;https://rawg.io/games/hospital-tycoon
killer7;70;Juin;2005;Action, Adventure;2 hours;Engine Software, Grasshopper Manufacture;Capcom, NIS America;https://rawg.io/games/killer7
Incredipede;74;Octobre;2012;Action, Adventure, Simulation, Indie, Puzzle;1 hour;Northway Games, Colin Northway with art by Thomas Shahan;Northway Games;https://rawg.io/games/incredipede
Phoning Home;61;Février;2017;Action, Adventure, Indie;4 hours;ION LANDS;ION LANDS;https://rawg.io/games/phoning-home
Dark Void;57;Janvier;2010;Action, Shooter, Adventure;1 hour;Airtight Games;Capcom;https://rawg.io/games/dark-void
Disney•Pixar Toy Story 3: The Video Game;73;Juin;2010;Action, Adventure, Arcade, Family;1 hour;Disney Interactive Studios, Avalanche Software;Disney Interactive;https://rawg.io/games/toy-story-3
Hover: Revolt Of Gamers;69;Avril;2015;Action, Adventure, Racing, Indie;1 hour;Plug In Digital, Playdius, Midgar Studio, Fusty Game;Plug In Digital, Playdius, The Sidekicks;https://rawg.io/games/hover
Neverending Nightmares;68;Septembre;2014;Action, Adventure, Indie;4 hours;Infinitap Games;Infinitap Games;https://rawg.io/games/neverending-nightmares
Peggle Nights;76;Septembre;2008;Casual;2 hours;PopCap Games;PopCap Games;https://rawg.io/games/peggle-nights
Pokémon Alpha Sapphire, Omega Ruby;83;Novembre;2014;RPG;40 hours;Game Freak;Nintendo, The Pokemon Company;https://rawg.io/games/pokemon-omega-ruby
Raiden V: Director's Cut;75;Octobre;2017;Action, Shooter;1 hour;UFO Interactive Games, Moss Co, Moss Co.;UFO Interactive Games, UFO Interactive;https://rawg.io/games/raiden-v-directors-cut
There Is No Game: Wrong Dimension;88;Août;2020;Adventure, Casual, Indie, Puzzle;5 hours;Draw Me A Pixel;Draw Me A Pixel;https://rawg.io/games/there-is-no-game-wd
Front Mission Evolved;63;Août;2010;Action, Shooter;2 hours;Square Enix, Double Helix Games;Square Enix;https://rawg.io/games/front-mission-evolved
Rayman 3: Hoodlum Havoc;73;Février;2003;Action, Adventure, Platformer;1 hour;Ubisoft, Ubisoft Shanghai, Gameloft, Ubi Soft Shanghai, Ubi Soft Montpellier;Ubisoft Entertainment, Feral Interactive, Gameloft;https://rawg.io/games/rayman-3-hoodlum-havoc
Crashlands;78;Janvier;2016;Action, Adventure, RPG, Indie;5 hours;Butterscotch Shenanigans;Butterscotch Shenanigans;https://rawg.io/games/crashlands
WASTED;68;Juin;2016;Action, RPG, Simulation, Casual, Indie;3 hours;Mr. Podunkian, Studio Alona Rodeh, Eagle Wu, Rachid Moro, Federico Zurani, Rachel Kinrot;Adult Swim Games, Studio Alona Rodeh;https://rawg.io/games/wasted
The Blue Flamingo;55;Novembre;2014;Action, Indie;3 hours;Might and Delight;Might and Delight;https://rawg.io/games/the-blue-flamingo
Dead Island Retro Revenge;65;Mai;2016;Action;1 hour;Deep Silver, Empty Clip Studios;Deep Silver;https://rawg.io/games/dead-island-retro-revenge-2
Black Mirror I;58;Octobre;2003;Adventure;2 hours;KING Art, Future Games, Unknown Identity;THQ Nordic, The Adventure Company;https://rawg.io/games/black-mirror
DARQ;70;Août;2019;Action, Adventure, Indie;3 hours;Unfold Games;Unfold Games;https://rawg.io/games/darq
BloodRayne Betrayal;68;Septembre;2011;Action, Adventure, Platformer;5 hours;Abstraction Games, WayForward Technologies, Majesco Entertainment Company;Majesco Entertainment, Midnight City;https://rawg.io/games/bloodrayne-betrayal-2
Enemy Front;52;Mai;2014;Action, Shooter;2 hours;City Interactive, CI Games;CI Games;https://rawg.io/games/enemy-front
Expeditions: Conquistador;77;Mai;2013;RPG, Strategy, Indie;3 hours;Logic Artists;Logic Artists;https://rawg.io/games/expeditions-conquistador
The Mooseman;74;Février;2017;Adventure, Educational, Indie, Puzzle;3 hours;Sometimes You, Evgeniy Kolpakov t/a Sometimes You, Morteshka, Vladimir Beletsky, Mikhail Shvachko, Vladimir Beletskiy;Sometimes You, Vladimir Beletsky, Vladimir Beletskiy;https://rawg.io/games/the-mooseman
The Warlock of Firetop Mountain;70;Août;2016;Action, Adventure, RPG, Board Games, Indie;3 hours;Tin Man Games;Tin Man Games;https://rawg.io/games/the-warlock-of-firetop-mountain
Disciples III - Renaissance;56;Décembre;2009;RPG, Strategy;1 hour;Akella, .dat;Kalypso Media;https://rawg.io/games/disciples-iii-renaissance
Overcooked! All You Can Eat;86;Novembre;2020;Action, Strategy, Simulation, Casual, Family, Indie;4 hours;Team17 Digital, Ghost Town Games;Team17 Digital;https://rawg.io/games/overcooked-all-you-can-eat
NBA 2K21;72;Septembre;2020;Simulation, Sports;19 hours;Visual Concepts, 2K Sports;2K Games;https://rawg.io/games/nba-2k21
Midnight Protocol;79;Octobre;2021;Action, RPG, Strategy, Indie;3 hours;LuGus Studios;Iceberg Interactive, LuGus Studios;https://rawg.io/games/midnight-protocol
Valdis Story: Abyssal City;83;Septembre;2013;Action, Adventure, RPG, Indie, Platformer;3 hours;Endlessfluff Games;Endlessfluff Games;https://rawg.io/games/valdis-story-abyssal-city
Kairo;76;Avril;2013;Adventure, Indie;2 hours;Locked Door Puzzle;Lupus Studios;https://rawg.io/games/kairo
Solasta: Crown of the Magister;77;Mai;2021;Adventure, RPG, Strategy;5 hours;Tactical Adventures;Tactical Adventures;https://rawg.io/games/solasta-crown-of-the-magister
Defense Grid 2;81;Septembre;2014;Strategy, Indie;5 hours;505 Games, Hidden Path Entertainment;505 Games, Hidden Path Entertainment;https://rawg.io/games/defense-grid-2
Hard Truck: Apocalypse;45;Juin;2006;Simulation, Racing;4 hours;CDV Software;Buka Entertainment;https://rawg.io/games/hard-truck-apocalypse
F1 2012;80;Septembre;2012;Sports, Racing;4 hours;Codemasters;Codemasters;https://rawg.io/games/f1-2012
Below;71;Décembre;2018;Adventure, RPG, Indie;1 hour;Capybara Games;Microsoft Studios, Capybara Games;https://rawg.io/games/below
NBA 2K15;80;Septembre;2014;Sports;34 hours;2K, Visual Concepts;2K Games, 2K Sports;https://rawg.io/games/nba-2k15
Bone: Out From Boneville;68;Juin;2008;Adventure;1 hour;Telltale Games;Telltale Games;https://rawg.io/games/bone-out-from-boneville
GRID (2019);75;Octobre;2019;Action, Sports, Racing, Arcade, Casual;1 hour;Codemasters;Codemasters;https://rawg.io/games/grid-3
Nether: Resurrected;57;Juin;2014;Action, RPG, Simulation, Massively Multiplayer, Indie;3 hours;Phosphor Games Studio;Nether Productions;https://rawg.io/games/nether-resurrected
Blue Estate;59;Juin;2014;Action, Shooter;4 hours;4EversGames, HE SAW, HeSaw;Focus Home Interactive, The Digital Lounge, HE SAW;https://rawg.io/games/blue-estate
Somerville;70;Novembre;2022;Action, Adventure;4 hours;Jumpship;Jumpship;https://rawg.io/games/somerville
Resident Evil 3: Nemesis;75;Septembre;1999;Action;18 hours;Capcom;Capcom;https://rawg.io/games/resident-evil-3-nemesis
Bulb Boy;84;Octobre;2015;Adventure, Indie, Puzzle;3 hours;Daedalic Entertainment, Bulbware;Daedalic Entertainment, Bulbware;https://rawg.io/games/bulb-boy
Bone: The Great Cow Race;76;Juin;2008;Adventure;1 hour;Telltale Games;Telltale Games;https://rawg.io/games/bone-the-great-cow-race
Silence of the Sleep;66;Octobre;2014;Adventure, Indie;3 hours;Jesse Makkonen;Jesse Makkonen;https://rawg.io/games/silence-of-the-sleep
The Count Lucanor;78;Mars;2016;Adventure, RPG, Indie;3 hours;Ratalaika Games, Merge Games, Baroque Decay;Merge Games, Baroque Decay;https://rawg.io/games/the-count-lucanor
Drakensang;75;Février;2009;RPG;1 hour;Radon Labs;DTP Entertainment;https://rawg.io/games/drakensang
Party Hard 2;70;Octobre;2018;Action, Adventure, Strategy, Simulation, Indie;2 hours;Pinokl Games, Kverta;tinyBuild;https://rawg.io/games/party-hard-2
Toy Soldiers;71;Mars;2010;Action, Strategy, Simulation, Casual;1 hour;Signal Studios;Microsoft Studios;https://rawg.io/games/toy-soldiers
Sherlock Holmes: The Awakened - Remastered Edition;72;Octobre;2008;Adventure;4 hours;Frogwares;Frogwares;https://rawg.io/games/sherlock-holmes-the-awakened-remastered-edition
The Amazing Spider-Man;64;Juin;2012;Action, Adventure;9 hours;Beenox, Gameloft, Mercenary Technology, Other Ocean Interactive;Activision Blizzard, Activison, Gameloft;https://rawg.io/games/the-amazing-spider-man
Say No! More;67;Avril;2021;Casual, Indie;2 hours;Studio Fizbin, Thunderful Publishing;Thunderful Publishing;https://rawg.io/games/say-no-more
MIND: Path to Thalamus Enhanced Edition;75;Août;2014;Adventure, Strategy, Indie;5 hours;Pantumaca Barcelona, @CarlosGameDev, Dani Navarro, Luka Nieto;Talking About Media;https://rawg.io/games/mind-path-to-thalamus-enhanced-edition
Lucius II;48;Février;2015;Action, Adventure, Simulation, Indie;4 hours;Shiver Games;Shiver Games;https://rawg.io/games/lucius-ii
Portal: Still Alive;90;Juin;2008;Action, Puzzle, Platformer;3 hours;Valve Software;Microsoft Studios;https://rawg.io/games/portal-still-alive
Hello Neighbor Hide and Seek;55;Décembre;2018;Action, Adventure, Puzzle;1 hour;tinyBuild, Dynamic Pixels;tinyBuild;https://rawg.io/games/hello-neighbor-hide-seek
Pilgrims;78;Octobre;2019;Adventure, Casual, Indie;2 hours;Amanita Design;Amanita Design;https://rawg.io/games/pilgrims
SpellForce 3;73;Décembre;2017;RPG, Strategy;4 hours;THQ Nordic, Grimlore Games;THQ Nordic;https://rawg.io/games/spellforce-3
RAD;72;Août;2019;Action;3 hours;BANDAI NAMCO Entertainment America, Double Fine Productions;Bandai Namco Entertainment, BANDAI NAMCO Entertainment US;https://rawg.io/games/rad-2
R.U.S.E.;77;Juillet;2010;Strategy, Simulation;3 hours;Ubisoft, Eugen Systems;Ubisoft Entertainment;https://rawg.io/games/ruse-2
Puddle;70;Janvier;2012;Action, Strategy, Simulation, Casual, Indie, Puzzle, Platformer;2 hours;Neko Entertainment, darrenville;Konami, Neko Entertainment, Spawn Digital, darrenville;https://rawg.io/games/puddle
Diaries of a Spaceport Janitor;69;Septembre;2016;Adventure, RPG, Simulation, Casual, Indie;4 hours;tinyBuild, Sundae Month;tinyBuild;https://rawg.io/games/diaries-of-a-spaceport-janitor
Ultimate General: Gettysburg;84;Septembre;2014;Strategy, Simulation, Indie;3 hours;Game-Labs, Game Labs;Game-Labs, Gamelabs;https://rawg.io/games/ultimate-general-gettysburg
The Misadventures of P.B. Winterbottom;79;Février;2010;Adventure, Indie;1 hour;The Odd Gentlemen;2K Play;https://rawg.io/games/the-misadventures-of-pb-winterbottom
Lumo;77;Mai;2016;Adventure, Indie, Puzzle, Platformer;5 hours;Rising Star Games, Spiral House, Triple Eh?;Rising Star Games;https://rawg.io/games/lumo
Nightmares from the Deep: The Cursed Heart;58;Avril;2012;Adventure, Casual, Puzzle;4 hours;Artifex Mundi;Artifex Mundi;https://rawg.io/games/nightmares-from-the-deep-the-cursed-heart
Doodle God;64;Juin;2010;Simulation, Board Games, Casual, Educational, Indie, Puzzle;4 hours;8Floor, JoyBits, JoyBits Co;JoyBits, JoyBits Co;https://rawg.io/games/doodle-god
Hunted: The Demon’s Forge;61;Mai;2011;Action, Adventure;2 hours;Bethesda Softworks;Bethesda Softworks;https://rawg.io/games/hunted-the-demons-forge-2
Pro Evolution Soccer 2017;69;Septembre;2016;Simulation, Sports;47 hours;PES Productions;Konami;https://rawg.io/games/pes-2017
Cut the Rope;93;Octobre;2010;Arcade, Casual, Indie, Puzzle;1 hour;ZeptoLab;Chillingo;https://rawg.io/games/cut-the-rope
Space Run;73;Juin;2014;Strategy, Indie;5 hours;Focus Home Interactive, Passtech Games;Focus Home Interactive;https://rawg.io/games/space-run
Command & Conquer 4: Tiberian Twilight;64;Mars;2010;Strategy;2 hours;Electronic Arts Los Angeles;Electronic Arts;https://rawg.io/games/command-conquer-4-tiberian-twilight
NIER;68;Avril;2010;Action, RPG;18 hours;Square Enix;Square Enix;https://rawg.io/games/nier
One Finger Death Punch 2;81;Avril;2019;Action, Casual, Fighting, Indie;3 hours;Silver Dollar Games;Silver Dollar Games;https://rawg.io/games/one-finger-death-punch-2-2
Tom Clancy's Ghost Recon;80;Janvier;2001;Action, Shooter;1 hour;Red Storm;Ubisoft Entertainment, Aspyr;https://rawg.io/games/tom-clancys-ghost-recon
Chronology;70;Mai;2014;Adventure, Indie, Puzzle, Platformer;3 hours;Bedtime Digital Games, Osao Games;4EversGames, Bedtime Digital Games, Osao Games;https://rawg.io/games/chronology
Jagged Alliance - Back in Action;62;Février;2012;RPG, Strategy, Simulation;3 hours;Bigmoon Studios, Coreplay;THQ Nordic;https://rawg.io/games/jagged-alliance-back-in-action
SiN Episodes: Emergence;75;Mai;2006;Action, Shooter;1 hour;Ritual Entertainment;Electronic Arts, Valve, Buka Entertainment, CyberFront;https://rawg.io/games/sin-episodes-emergence
Five Nights at Freddy's 3;68;Mars;2015;Action, Simulation, Indie;2 hours;Scott Cawthon;Scott Cawthon, CLICKTEAM L.L.C.;https://rawg.io/games/five-nights-at-freddys-3
Chaser;66;Juin;2003;Action, Shooter, Adventure, Racing, Arcade, Casual, Indie;2 hours;Cauldron, Sam Signey, Aditya Yadav, Waterboat;THQ Nordic, Sam Signey, Aditya Yadav, Waterboat;https://rawg.io/games/chaser
Final Exam;66;Septembre;2013;Action, Adventure, Indie;4 hours;Mighty Rocket Studio;Focus Home Interactive;https://rawg.io/games/final-exam
Space Run Galaxy;75;Juin;2016;Strategy, Indie;4 hours;Passtech Games;Focus Home Interactive;https://rawg.io/games/space-run-galaxy
Steelrising;71;Septembre;2022;Action, Adventure, RPG;2 hours;Spiders;Nacon;https://rawg.io/games/steelrising
Pneuma: Breath of Life;63;Février;2015;Adventure, Indie, Puzzle;5 hours;Deco Digital, Bevel Studios;Deco Digital & Bevel Studios, Deco Digital;https://rawg.io/games/pneuma-breath-of-life
Riven: The Sequel to Myst;83;Octobre;1997;Adventure, Casual, Indie, Puzzle;1 hour;Noodlecake Studios, Cyan Worlds;SEGA, Acclaim Entertainment, Cyan Worlds, Red Orb Entertainment;https://rawg.io/games/riven
Lake;73;Septembre;2021;Adventure;3 hours;Gamious;Whitethorn Digital, Gamious;https://rawg.io/games/lake
Kinect Sports;73;Novembre;2010;Sports, Family;3 hours;Rare;Microsoft Game Studios;https://rawg.io/games/kinect-sports
Kingdom Hearts HD 2.8 Final Chapter Prologue;79;Janvier;2017;Action, Adventure, RPG;8 hours;Square Enix;Square Enix;https://rawg.io/games/kingdom-hearts-hd-28-final-chapter-prologue
Ring Runner: Flight of the Sages;75;Juillet;2013;Action, Shooter, RPG, Indie;3 hours;Triple.B.Titles, Triple-B-Titles;Triple.B.Titles, Triple-B-Titles;https://rawg.io/games/ring-runner-flight-of-the-sages
Trover Saves the Universe;78;Mai;2019;Action, Adventure, Indie;3 hours;Squanch Games, Squanchtendo;Sony Interactive Entertainment, Squanch Games;https://rawg.io/games/trover-saves-the-universe
Fortix 2;74;Mai;2011;Casual, Indie;3 hours;Nemesys Games;Nemesys Games;https://rawg.io/games/fortix-2
A.R.E.S.: Extinction Agenda;68;Janvier;2011;Action, Indie;2 hours;Extend Studio;Extend Studio;https://rawg.io/games/ares-extinction-agenda
Thunder Wolves;69;Mai;2013;Action, Shooter, Casual, Indie;1 hour;Most Wanted Entertainment;THQ Nordic, HandyGames, bitComposer Entertainment;https://rawg.io/games/thunder-wolves
Pro Evolution Soccer 2016;83;Septembre;2015;Sports;33 hours;PES Productions;Konami;https://rawg.io/games/pes-2016
The Gunk;69;Décembre;2021;Action, Adventure;2 hours;Image & Form;Thunderful Publishing;https://rawg.io/games/the-gunk
Puzzle Quest: Challenge of the Warlords;84;Mars;2007;Casual, Puzzle;3 hours;D3 Publisher, Vicious Cycle Software, Infinite Interactive;D3 Publisher;https://rawg.io/games/puzzle-quest
Banjo-Tooie;90;Novembre;2000;Action, Adventure, Platformer;2 hours;Rare, 4J Studios;Microsoft Studios, Nintendo;https://rawg.io/games/banjo-tooie
Go Home Dinosaurs!;79;Mars;2013;Strategy, Casual, Indie;3 hours;Fire Hose Games;Fire Hose Games;https://rawg.io/games/go-home-dinosaurs
Dungeon Souls;67;Décembre;2016;Action, Adventure, RPG, Indie;5 hours;Lamina Studios, Mike Studios;Black Shell Media;https://rawg.io/games/dungeon-souls
Grotesque Tactics: Evil Heroes;65;Février;2010;RPG, Strategy, Indie;1 hour;Headup Games, Silent Dreams;Headup Games;https://rawg.io/games/grotesque-tactics-evil-heroes
Ghostbusters: The Video Game Remastered;68;Octobre;2019;Action;1 hour;Saber Interactive;Saber Interactive, Mad Dog Games;https://rawg.io/games/ghostbusters-the-video-game-remastered
The Way;67;Mai;2016;Action, Adventure, Indie, Puzzle, Platformer;4 hours;Puzzling Dream;PlayWay;https://rawg.io/games/the-way
Cold Fear;66;Mars;2005;Action;1 hour;GOG, Darkworks;Ubisoft Entertainment, Atari;https://rawg.io/games/cold-fear
Riders Republic;78;Octobre;2021;Action, Sports, Massively Multiplayer;2 hours;Ubisoft, Ubisoft Annecy, Ubisoft Pune, Ubisoft Kyiv, Ubisoft Belgrade, Ubisoft Odesa;Ubisoft Entertainment;https://rawg.io/games/riders-republic
CT Special Forces: Fire for Effect;62;Mars;2014;Action, Shooter;1 hour;Asobo Studio, Hip Games;Kiss, Funbox Media;https://rawg.io/games/ct-special-forces-fire-for-effect
Sins of a Solar Empire: Trinity;87;Février;2010;Strategy;1 hour;Stardock Entertainment, Ironclad Games;Stardock Entertainment;https://rawg.io/games/sins-of-a-solar-empire-trinity
Strong Bad's Cool Game for Attractive People;82;Décembre;2008;Adventure;1 hour;Telltale Games;Telltale Games;https://rawg.io/games/strong-bads-cool-game-for-attractive-people
Dream Daddy: A Dad Dating Simulator;73;Juillet;2017;RPG, Simulation, Casual, Indie;5 hours;Game Grumps;Game Grumps;https://rawg.io/games/dream-daddy
The Magic Circle;79;Juillet;2015;Action, Adventure, Strategy, Simulation, Indie;3 hours;Question;Question;https://rawg.io/games/the-magic-circle
I Expect You To Die;76;Décembre;2016;Indie, Puzzle;2 hours;Schell Games;Schell Games;https://rawg.io/games/i-expect-you-to-die
Larva Mortus;64;Septembre;2008;Action, Indie;1 hour;Meridian4, Rake in Grass;Meridian4, Immanitas Entertainment;https://rawg.io/games/larva-mortus
Wargame: Airland Battle;80;Mai;2013;Strategy;4 hours;Eugen Systems;Focus Home Interactive;https://rawg.io/games/wargame-airland-battle
Analogue: A Hate Story;62;Février;2012;Indie;2 hours;Love Conquers All Games;Love Conquers All Games;https://rawg.io/games/analogue-a-hate-story
The Legend of Heroes: Trails of Cold Steel;79;Septembre;2013;RPG;10 hours;Nihon Falcom, XSEED Games;XSEED Games, Marvelous USA;https://rawg.io/games/the-legend-of-heroes-trails-of-cold-steel
Scribblenauts Unmasked: A DC Comics Adventure;68;Septembre;2013;Action, Adventure, Strategy, Casual;5 hours;5TH Cell, 5th Cell Media;Warner Bros. Interactive;https://rawg.io/games/scribblenauts-unmasked-a-dc-comics-adventure
SteamWorld Quest: Hand of Gilgamech;81;Avril;2019;Action, Adventure, RPG, Card;3 hours;Image & Form, Form International;Thunderful Publishing, Image & Form, Image & Form International, Thunderful;https://rawg.io/games/steamworld-quest
Hamilton's Great Adventure;77;Mai;2011;Action, Adventure, Casual, Indie;2 hours;Fatshark;Fatshark;https://rawg.io/games/hamiltons-great-adventure
Sherlock Holmes - Nemesis;71;Novembre;2007;Adventure, RPG;4 hours;Frogwares;Focus Home Interactive, Frogwares;https://rawg.io/games/sherlock-holmes-nemesis
Metroid Prime;97;Novembre;2002;Action, Shooter, Adventure;2 hours;Retro Studios;Nintendo;https://rawg.io/games/metroid-prime
Brothers in Arms: Road to Hill 30;87;Mars;2005;Action;2 hours;Gearbox Software;Ubisoft Entertainment;https://rawg.io/games/brothers-in-arms-road-to-hill-30
Damnation;41;Mai;2009;Action, Shooter, Adventure;1 hour;Blue Omega Entertainment;Codemasters;https://rawg.io/games/damnation
Tom Clancy's EndWar;68;Novembre;2008;Strategy, Simulation;1 hour;Ubisoft, Ubisoft Shanghai;Ubisoft Entertainment;https://rawg.io/games/tcs-endwar
Space Hulk;58;Août;2013;Strategy, Board Games, Indie;3 hours;Hoplite Research, Full Control Studios, Full Control, Plunge Interactive;Full Control, Full Control Studios ApS, HR GAMES;https://rawg.io/games/space-hulk
The Next BIG Thing;75;Avril;2011;Adventure, Family;3 hours;Focus Home Interactive, Pendulo Studios;1C-SoftClub, Focus Home Interactive;https://rawg.io/games/the-next-big-thing
Football Manager 2020;84;Novembre;2019;Simulation, Sports;29 hours;Sports Interactive;SEGA;https://rawg.io/games/football-manager-2020
Conarium;73;Juin;2017;Adventure, Indie;3 hours;Zoetrope Interactive;Iceberg Interactive;https://rawg.io/games/conarium
Super Mario 3D Land;90;Novembre;2011;Platformer;17 hours;Nintendo;Nintendo;https://rawg.io/games/super-mario-3d-land
Dead or Alive 5;77;Septembre;2012;Arcade, Fighting;8 hours;Koei Tecmo, Team NINJA, KOEI TECMO America, LTD/Team NINJA;Tecmo Koei America, Tecmo Koei;https://rawg.io/games/dead-or-alive-5
